{
    "$schema": "http://json-schema.org/draft-07/schema",
    "type": "array",
    "items": {
        "type": "object",
        "properties": {
            "id": {
                "description": "The unique identifier for the package, formatted in tld.company.appname",
                "type": "string"
            },
            "name": {
                "type": "string"
            },
            "publisher": {
                "type": "string"
            },
            "author": {
                "oneOf": [
                    {
                        "type": "string"
                    },
                    {
                        "type": "array",
                        "uniqueItems": true
                    }
                ]
            },
            "description": {
                "type": "string"
            },
            "homepage": {
                "type": "string"
            },
            "license": {
                "type": "string"
            },
            "available": {
                "type": "array",
                "contains": {
                    "type": "string",
                    "enum": ["Windows", "Linux", "macOS","Android"]
                },
                "uniqueItems": true
            },
            "packages": {
                "type": "object",
                "properties": {
                    "windows": {
                        "type": "object",
                        "properties": {
                            "winget": {
                                "oneOf": [
                                    {
                                        "type": "string",
                                        "pattern": "^[a-zA-Z0-9\\-\\+]+\\.[a-zA-Z0-9\\-\\+!]+(\\.[a-zA-Z0-9\\.]+)?$"
                                    },
                                    {
                                        "type": "null"
                                    }
                                ]
                            },
                            "choco": {
                                "oneOf": [
                                    {
                                        "type": "string"
                                    },
                                    {
                                        "type": "null"
                                    }
                                ]
                            },
                            "scoop": {
                                "oneOf": [
                                    {
                                        "type": "string"
                                    },
                                    {
                                        "type": "null"
                                    }
                                ]
                            },
                            "bin": {
                                "oneOf": [
                                    {
                                        "type": "string"
                                    },
                                    {
                                        "type": "null"
                                    }
                                ]
                            }
                        },
                        "additionalProperties": false
                    },
                    "linux": {
                        "type": "object",
                        "additionalProperties": false,
                        "properties": {
                            "apt": {
                                "oneOf": [
                                    {
                                        "type": "string"
                                    },
                                    {
                                        "type": "null"
                                    }
                                ]
                            },
                            "snap": {
                                "oneOf": [
                                    {
                                        "type": "string"
                                    },
                                    {
                                        "type": "null"
                                    }
                                ]
                            },
                            "flatpak": {
                                "oneOf": [
                                    {
                                        "type": "string"
                                    },
                                    {
                                        "type": "null"
                                    }
                                ]
                            },
                            "bin": {
                                "oneOf": [
                                    {
                                        "type": "string"
                                    },
                                    {
                                        "type": "null"
                                    }
                                ]
                            },
                            "debGet": {
                                "oneOf": [
                                    {
                                        "type": "string"
                                    },
                                    {
                                        "type": "null"
                                    }
                                ]
                            },
                            "pacstall": {
                                "oneOf": [
                                    {
                                        "type": "string"
                                    },
                                    {
                                        "type": "null"
                                    }
                                ]
                            },
                            "dnf": {
                                "oneOf": [
                                    {
                                        "type": "string"
                                    },
                                    {
                                        "type": "null"
                                    }
                                ]
                            },
                            "apk": {
                                "oneOf": [
                                    {
                                        "type": "string"
                                    },
                                    {
                                        "type": "null"
                                    }
                                ]
                            },
                            "appimage": {
                                "oneOf": [
                                    {
                                        "type": "string",
                                        "format": "uri"
                                    },
                                    {
                                        "type": "null"
                                    }
                                ]
                            },
                            "aur": {
                                "oneOf": [
                                    {
                                        "type": "string"
                                    },
                                    {
                                        "type": "null"
                                    }
                                ]
                            },
                            "nixpkgs": {
                                "oneOf": [
                                    {
                                        "type": "string"
                                    },
                                    {
                                        "type": "null"
                                    }
                                ]
                            },
                            "brew": {
                                "oneOf": [
                                    {
                                        "type": "string"
                                    },
                                    {
                                        "type": "null"
                                    }
                                ]
                            }
                        }
                    },
                    "android": {
                        "type": "object",
                        "additionalProperties": false,
                        "properties": {
                            "pkg": {
                                "oneOf": [
                                    {
                                        "type": "string"
                                    },
                                    {
                                        "type": "null"
                                    }
                                ]
                            },
                            "play" : {
                                "oneOf": [
                                    {
                                        "type": "string"
                                    },
                                    {
                                        "type": "null"
                                    }
                                ]
                            },
                            "bin": {
                                "oneOf": [
                                    {
                                        "type": "string"
                                    },
                                    {
                                        "type": "null"
                                    }
                                ]
                            }
                        }
                    }
                },
                "additionalProperties": false
            }
        },
        "additionalProperties": false
    },
    "uniqueItems": true
}
