[
  {
    "id": "org.7-zip.7-Zip",
    "name": "7-Zip",
    "publisher": "Igor Pavlov",
    "author": "Igor Pavlov",
    "homepage": "https://www.7-zip.org",
    "license": "LGPL",
    "available": [
      "Windows"
    ],
    "packages": {
      "windows": {
        "choco": "7zip",
        "scoop": null,
        "winget": "7zip.7zip"
      },
      "linux": {
        "apk": null,
        "appimage": null,
        "apt": null,
        "aur": null,
        "brew": null,
        "debGet": null,
        "dnf": null,
        "flatpak": null,
        "nixpkgs": null,
        "pacstall": null,
        "snap": null
      },
      "android": {
        "pkg": null,
        "play": null
      }
    }
  },
  {
    "id": "ru.aimp.AIMP",
    "name": "AIMP",
    "publisher": "AIMP DevTeam",
    "author": "Artem Izmaylov",
    "homepage": "https://www.aimp.ru",
    "license": "Proprietary",
    "available": [
      "Windows",
      "Android"
    ],
    "packages": {
      "windows": {
        "choco": "aimp",
        "scoop": "aimp",
        "winget": "AIMP.AIMP"
      },
      "linux": {
        "apk": null,
        "appimage": null,
        "apt": null,
        "aur": null,
        "brew": null,
        "debGet": null,
        "dnf": null,
        "flatpak": null,
        "nixpkgs": null,
        "pacstall": null,
        "snap": null
      },
      "android": {
        "pkg": null,
        "play": "com.aimp.player"
      }
    }
  },
  {
    "id": "com.aomeitech.PartitionAssistant",
    "name": "AOMEI Partition Assistant",
    "publisher": "AOMEI International Network Limited.",
    "author": "AOMEI International Network Limited.",
    "homepage": "https://www.aomeitech.com/aomei-partition-assistant.html",
    "license": "Proprietary",
    "available": [
      "Windows"
    ],
    "packages": {
      "windows": {
        "choco": "partition-assistant-standard",
        "scoop": null,
        "winget": "AOMEI.PartitionAssistant"
      },
      "linux": {
        "apk": null,
        "appimage": null,
        "apt": null,
        "aur": null,
        "brew": null,
        "debGet": null,
        "dnf": null,
        "flatpak": null,
        "nixpkgs": null,
        "pacstall": null,
        "snap": null
      },
      "android": {
        "pkg": null,
        "play": null
      }
    }
  },
  {
    "id": "org.audacityteam.Audacity",
    "name": "Audacity",
    "publisher": "Audacity Team",
    "author": "Audacity Team",
    "homepage": "https://www.audacityteam.org/",
    "license": "GPL-2.0-or-later",
    "available": [
      "Windows",
      "Linux"
    ],
    "packages": {
      "windows": {
        "choco": "audacity",
        "scoop": "audacity",
        "winget": "Audacity.Audacity"
      },
      "linux": {
        "apk": "audacity",
        "appimage": null,
        "apt": "audacity",
        "aur": "audacity-git",
        "brew": null,
        "debGet": null,
        "dnf": "audacity",
        "flatpak": "org.audacityteam.Audacity",
        "nixpkgs": "audacity",
        "pacstall": null,
        "snap": "audacity"
      },
      "android": {
        "pkg": null,
        "play": null
      }
    }
  },
  {
    "id": "com.autohotkey.AutoHotkey",
    "name": "AutoHotkey",
    "publisher": "Lexikos",
    "author": "Steve Gray",
    "homepage": "https://autohotkey.com",
    "license": "GPL-2.0",
    "available": [
      "Windows"
    ],
    "packages": {
      "windows": {
        "choco": "autohotkey",
        "scoop": "autohotkey",
        "winget": "Lexikos.AutoHotkey"
      },
      "linux": {
        "apk": null,
        "appimage": null,
        "apt": null,
        "aur": null,
        "brew": null,
        "debGet": null,
        "dnf": null,
        "flatpak": null,
        "nixpkgs": null,
        "pacstall": null,
        "snap": null
      },
      "android": {
        "pkg": null,
        "play": null
      }
    }
  },
  {
    "id": "io.balena.Etcher",
    "name": "balenaEtcher",
    "publisher": "Balena Inc.",
    "author": "Balena Inc.",
    "homepage": "https://www.balena.io/etcher",
    "license": "Apache License 2.0",
    "available": [
      "Windows",
      "Linux"
    ],
    "packages": {
      "windows": {
        "choco": "etcher",
        "scoop": null,
        "winget": "Balena.Etcher"
      },
      "linux": {
        "apk": null,
        "appimage": null,
        "apt": null,
        "aur": null,
        "brew": null,
        "debGet": "balena-etcher-electron",
        "dnf": null,
        "flatpak": null,
        "nixpkgs": null,
        "pacstall": null,
        "snap": null
      },
      "android": {
        "pkg": null,
        "play": null
      }
    }
  },
  {
    "id": "eu.betterbird.Betterbird",
    "name": "Betterbird",
    "publisher": "Betterbird-Team",
    "author": "Betterbird-Team",
    "homepage": "https://betterbird.eu",
    "license": "MPL-2.0",
    "available": [
      "Windows",
      "Linux"
    ],
    "packages": {
      "windows": {
        "choco": "betterbird",
        "scoop": null,
        "winget": "Betterbird.Betterbird"
      },
      "linux": {
        "apk": null,
        "appimage": null,
        "apt": null,
        "aur": "betterbird-bin",
        "brew": null,
        "debGet": null,
        "dnf": null,
        "flatpak": "eu.betterbird.Betterbird",
        "nixpkgs": null,
        "pacstall": null,
        "snap": null
      },
      "android": {
        "pkg": null,
        "play": null
      }
    }
  },
  {
    "id": "com.bitwarden.Bitwarden",
    "name": "Bitwarden",
    "publisher": "Bitwarden Inc.",
    "author": "Bitwarden Inc.",
    "homepage": "https://bitwarden.com/download/",
    "license": "GPL-3.0 or Bitwarden-1.0",
    "available": [
      "Windows",
      "Linux",
      "Android"
    ],
    "packages": {
      "windows": {
        "choco": "bitwarden",
        "scoop": "bitwarden",
        "winget": "Bitwarden.Bitwarden"
      },
      "linux": {
        "apk": null,
        "appimage": null,
        "apt": null,
        "aur": "bitwarden-git",
        "brew": null,
        "debGet": "bitwarden",
        "dnf": null,
        "flatpak": "com.bitwarden.desktop",
        "nixpkgs": "bitwarden",
        "pacstall": "bitwarden-deb",
        "snap": "bitwarden"
      },
      "android": {
        "pkg": null,
        "play": "com.x8bit.bitwarden"
      }
    }
  },
  {
    "id": "com.brave.Browser",
    "name": "Brave",
    "publisher": "Brave Software Inc",
    "author": "Brave Software, Inc.",
    "homepage": "https://brave.com/download/",
    "license": "MPL-2.0",
    "available": [
      "Windows",
      "Linux",
      "Android"
    ],
    "packages": {
      "windows": {
        "choco": "brave",
        "scoop": "brave",
        "winget": "Brave.Brave"
      },
      "linux": {
        "apk": null,
        "appimage": null,
        "apt": null,
        "aur": null,
        "brew": null,
        "debGet": "brave",
        "dnf": null,
        "flatpak": "com.brave.Browser",
        "nixpkgs": null,
        "pacstall": null,
        "snap": null
      },
      "android": {
        "pkg": null,
        "play": "com.brave.browser"
      }
    }
  },
  {
    "id": "com.calibre_ebook.calibre",
    "name": "calibre",
    "publisher": "Kovid Goyal",
    "author": "Kovid Goyal",
    "homepage": "https://calibre-ebook.com/",
    "license": "GPL-3.0-only",
    "available": [
      "Windows",
      "Linux"
    ],
    "packages": {
      "windows": {
        "choco": "calibre",
        "scoop": "calibre",
        "winget": "calibre.calibre"
      },
      "linux": {
        "apk": null,
        "appimage": null,
        "apt": null,
        "aur": null,
        "brew": null,
        "debGet": null,
        "dnf": null,
        "flatpak": "com.calibre_ebook.calibre",
        "nixpkgs": null,
        "pacstall": null,
        "snap": null
      },
      "android": {
        "pkg": null,
        "play": null
      }
    }
  },
  {
    "id": "io.github.chrisant996.Clink",
    "name": "Clink",
    "publisher": "Christopher Antos",
    "author": "Chris Antos",
    "homepage": "https://chrisant996.github.io/clink/",
    "license": "GPL-3.0",
    "available": [
      "Windows"
    ],
    "packages": {
      "windows": {
        "choco": "clink",
        "scoop": "clink",
        "winget": "chrisant996.Clink"
      },
      "linux": {
        "apk": null,
        "appimage": null,
        "apt": null,
        "aur": null,
        "brew": null,
        "debGet": null,
        "dnf": null,
        "flatpak": null,
        "nixpkgs": null,
        "pacstall": null,
        "snap": null
      },
      "android": {
        "pkg": null,
        "play": null
      }
    }
  },
  {
    "id": "com.cloudflare.warp",
    "name": "Cloudflare WARP",
    "publisher": "Cloudflare, Inc.",
    "author": "Cloudflare, Inc.",
    "homepage": "https://one.one.one.one/",
    "license": "Proprietary",
    "available": [
      "Windows",
      "Android"
    ],
    "packages": {
      "windows": {
        "choco": "warp",
        "scoop": null,
        "winget": "Cloudflare.Warp"
      },
      "linux": {
        "apk": null,
        "appimage": null,
        "apt": null,
        "aur": null,
        "brew": null,
        "debGet": null,
        "dnf": null,
        "flatpak": null,
        "nixpkgs": null,
        "pacstall": null,
        "snap": null
      },
      "android": {
        "pkg": null,
        "play": "com.cloudflare.onedotonedotonedotone"
      }
    }
  },
  {
    "id": "se.curl.cURL",
    "name": "curl",
    "publisher": "cURL project",
    "author": "Daniel Stenberg",
    "homepage": "https://curl.se/",
    "license": "curl",
    "available": [
      "Windows",
      "Linux"
    ],
    "packages": {
      "windows": {
        "choco": "curl",
        "scoop": "curl",
        "winget": null
      },
      "linux": {
        "apk": "curl",
        "appimage": null,
        "apt": "curl",
        "aur": "curl",
        "brew": null,
        "debGet": null,